{
  "usecasefile": "usecases/other/discoverycenter/3638-kyma-multitenant/usecase-trial.json",
  "region": "us10",
  "subaccountname": "trial",
  "loginmethod": "sso",
  "envvariables": {        
    "BTPSA_KYMA_IMAGE_NAME_APPROUTER": "ghcr.io/alexrieder/btp-kyma-multitenant-extension-approuter:main",
    "BTPSA_KYMA_IMAGE_NAME_DB_SERVICE": "ghcr.io/alexrieder/btp-kyma-multitenant-extension-db-service:main",
    "BTPSA_KYMA_IMAGE_NAME_BP_SERVICE": "ghcr.io/alexrieder/btp-kyma-multitenant-extension-bp-service:main",
    "BTPSA_KYMA_IMAGE_NAME_EF_SERVICE": "ghcr.io/alexrieder/btp-kyma-multitenant-extension-ef-service:main",                
    "BTPSA_KYMA_IMAGE_NAME_BROKER": "ghcr.io/alexrieder/btp-kyma-multitenant-extension-broker:main",
    "BTPSA_KYMA_IMAGE_NAME_EMAIL_SERVICE": "ghcr.io/alexrieder/btp-kyma-multitenant-extension-email-service:main",
    "BTPSA_KYMA_IMAGE_NAME_UI": "ghcr.io/alexrieder/btp-kyma-multitenant-extension-ui:main",
    "BTPSA_KYMA_IMAGE_NAME_BUSINESS_PARTNER_MOCK": "ghcr.io/alexrieder/btp-kyma-multitenant-extension-business-partner-mock:main"  
  }
}