{
  "usecasefile": "./usecase.json",
  "region": "us10",
  "globalaccount": "sap-developer-advocates-free-tier",
  "myemail": "dj.adams@sap.com",
  "loginmethod": "basicAuthentication",
  "subaccountname": "ECCExtension",
  "cfspacename": "dev",
  "myusergroups": [
    {
      "name": "admins",
      "members": []
    }
  ]
}
