{
  "usecasefile": "https://raw.githubusercontent.com/SAP-samples/btp-setup-automator/main/integrationtests/usecasefiles/usecase_it05_one_service_only.json",
  "loginmethod": "basicAuthentication",
  "region": "eu10",
  "subaccountname": "My own subacccount name",
  "subdomain": "my own subdomain with -",
  "cfspacename": "development",
  "suffixinstancename": "my own suffix",
  "fallbackserviceplan": null,
  "repeatstatusrequest": 4,
  "repeatstatustimeout": 4200,
  "logcommands": true,
  "pruneusecase": true,
  "prunesubaccount": true
}