{
  "usecasefile": "https://raw.githubusercontent.com/SAP-samples/btp-setup-automator/main/integrationtests/usecasefiles/usecase_it06_service_key_creation.json",
  "loginmethod": "envVariables",
  "cfspacename": "my own space",
  "prunesubaccount": true,
  "subaccountname": "BTPSA int-test service keys"
}